budget,id,original_language,popularity,release_date,revenue,runtime,status,tagline,title,vote_average,vote_count
10000000,24034,en,1.374409,2004-01-16,0,74.0,Released,A musical tail about one dog's dream of becoming a boy,Teacher's Pet,5.5,2
23600000,19908,en,57.300674,2009-10-07,102391382,88.0,Released,This place is so dead,Zombieland,7.2,3550
2500000,26039,en,5.164423,1967-08-30,3200000,92.0,Released,There are two kinds of people in his up-tight world: his victims and his women. And sometimes you can't tell them apart.,Point Blank,7.1,95
55000000,109424,en,52.786917,2013-10-10,95000000,134.0,Released,Out here survival is everything.,Captain Phillips,7.6,2454
40000000,11130,en,30.002907,2004-08-06,95149435,113.0,Released,It can take a lifetime to find true love; she's got 30 days!,The Princess Diaries 2: Royal Engagement,6.0,697
50000000,145220,en,14.808304,2014-03-20,80383290,112.0,Released,Taking the world by farce,Muppets Most Wanted,6.2,316
5000000,157547,en,35.871248,2013-09-08,44030246,104.0,Released,You see what it wants you to see,Oculus,6.3,1050
0,112937,en,0.28576,2012-08-29,0,88.0,Released,,The Oogieloves in the Big Balloon Adventure,2.2,8
70000000,9509,en,45.299089,2004-04-23,130293714,146.0,Released,"Creasy's art is death, and he is about to paint his masterpiece.",Man on Fire,7.3,1553
5000000,2295,en,18.077963,2006-05-25,26888376,97.0,Released,With No Power Comes No Responsibility,Clerks II,6.9,398
6000000,25462,en,2.27213,2001-09-07,0,90.0,Released,,Two Can Play That Game,6.6,17
68000000,9824,en,12.948627,1999-08-06,29762011,121.0,Released,"We're not your classic heroes, we're the other guys.",Mystery Men,5.7,250
100000000,9836,en,37.272385,2006-11-16,384335608,108.0,Released,WARNING: May Cause Toe-Tapping.,Happy Feet,5.9,1410
50000000,316152,en,21.589393,2016-06-24,25035950,139.0,Released,Based on the incredible true story.,Free State of Jones,6.6,428
5000000,2895,en,4.227807,1997-10-09,0,134.0,Released,The hardest soul to save was his own.,The Apostle,6.1,38
19000000,21309,en,6.463806,1986-08-27,0,99.0,Released,The most controversial film you will see this year.,River's Edge,6.7,59
0,239566,en,13.064264,2014-08-01,31911598,139.0,Released,The Funk Don't Quit,Get on Up,6.4,158
20000000,314365,en,41.503588,2015-11-06,88346473,128.0,Released,Break the story. Break the silence.,Spotlight,7.8,2686
35000000,9029,da,38.100488,2008-05-07,170000000,99.0,Released,Get Lucky,What Happens in Vegas,5.8,923
967686,37495,en,20.544999,2010-05-07,4270000,101.0,Released,We are 4 Lions.,Four Lions,7.0,423
22000,255266,en,0.048948,2013-02-14,0,90.0,Released,Getting divorced does funny things to a girl,Dry Spell,6.0,1
60000000,8645,en,20.501582,2008-06-11,163403799,91.0,Released,We've Sensed It. We've Seen The Signs. Now... It's Happening.,The Happening,4.9,950
18500000,23082,en,16.665841,2009-09-13,31912793,100.0,Released,In a world where everyone can only tell the truth... This guy can lie.,The Invention of Lying,6.0,518
6000000,1443,en,26.218912,1999-04-21,10409377,97.0,Released,"Beautiful, mysterious, haunting, invariably fatal. Just like life.",The Virgin Suicides,7.1,817
0,14778,en,3.603842,2001-09-10,0,109.0,Released,,Last Orders,6.0,22
0,205588,en,10.547959,2016-05-05,9930095,108.0,Released,Who Can You Trust With The Truth?,Our Kind of Traitor,6.0,160
5500000,33155,en,2.141143,1980-06-06,4865000,95.0,Released,She's too good to be true...and too real to be otherwise.,Galaxina,3.3,16
750000,376004,en,1.471139,2016-01-05,0,80.0,Released,Love. Betrayal. Vengeance,Adulterers,5.2,16
0,2211,de,2.832628,1999-02-10,0,125.0,Released,,Aimee & Jaguar,6.3,20
13800000,11873,en,17.3393,1986-10-07,52293982,119.0,Released,The Hustler isn't what he used to be. But he has the next best thing. A kid who is.,The Color of Money,6.7,291
45000000,10478,en,10.731574,1996-08-16,53854588,135.0,Released,Golf Pro. Love Amateur.,Tin Cup,5.9,150
30000000,6466,en,26.69592,2003-08-15,114908830,97.0,Released,Evil Will Battle Evil,Freddy vs. Jason,5.8,594
32000000,13920,en,9.254647,2003-10-24,52277485,109.0,Released,His courage made them champions.,Radio,6.8,141
0,281730,en,0.371337,2014-06-13,0,134.0,Released,,Fugly,5.3,2
15000000,64689,en,24.612603,2012-09-20,37930465,97.0,Released,In America you're on your own.,Killing Them Softly,5.8,742
56000000,16072,en,4.362535,2003-02-21,12923936,214.0,Released,The nations heart was touched by...,Gods and Generals,6.1,48
0,13538,en,8.302951,2007-04-27,0,88.0,Released,Let the revenge fit the crime,Straightheads,5.2,40
0,16110,en,1.916351,2000-07-26,0,85.0,Released,Little Engines CAN Do Big Things...,Thomas and the Magic Railroad,4.6,8
20000000,1975,en,13.906944,2006-10-13,39143839,102.0,Released,"What Was Once Trapped, Will Now Be Unleashed",The Grudge 2,5.2,283
12000000,38448,en,5.841285,2009-09-14,1644755,111.0,Released,The truth is not what you know. It's what you believe.,Ondine,6.5,84
15000000,12162,en,47.006162,2008-10-10,42000000,131.0,Released,You'll know when you're in it.,The Hurt Locker,7.2,1840
20000000,9716,en,12.379781,1996-12-06,0,101.0,Released,,Everyone Says I Love You,6.5,147
14000000,43949,en,24.210698,2010-08-06,1755212,89.0,Released,You never forget your first love.,Flipped,7.4,418
50000000,10533,en,7.44268,1995-10-13,10382407,135.0,Released,"When intimacy is forbidden and passion is a sin, love is the most defiant crime of all.",The Scarlet Letter,5.5,108
50000000,9390,en,27.039636,1996-12-06,273552592,139.0,Released,Everybody loved him... Everybody disappeared.,Jerry Maguire,6.7,913
35000000,1584,en,43.057323,2003-10-03,131282949,108.0,Released,He just landed the gig of his life: 5th grade.,School of Rock,6.7,1414
15000000,9793,en,17.141376,2007-03-22,0,89.0,Released,Help isn't coming.,The Hills Have Eyes 2,5.2,351
65000000,7980,en,29.257137,2009-12-26,93525586,136.0,Released,The story of a life and everything that came after...,The Lovely Bones,6.6,1065
60000000,13673,en,9.225166,2004-11-24,0,99.0,Released,No! Ho! Ho!,Christmas with the Kranks,5.2,193
44000000,72710,en,42.933027,2013-03-22,63327201,125.0,Released,You will be one of us,The Host,6.0,1817
185000000,155,en,187.322927,2008-07-16,1004558444,152.0,Released,Why So Serious?,The Dark Knight,8.2,12002
4000000,60422,en,3.238466,2011-11-18,355688,119.0,Released,"At this wedding, the F-word stands for Family",Another Happy Day,6.2,37
12000000,13335,en,26.219598,2008-04-25,43493123,107.0,Released,This time they're running from the joint.,Harold & Kumar Escape from Guantanamo Bay,6.2,497
30000000,615,en,38.171417,2004-02-25,611899420,127.0,Released,"By his wounds, we were healed.",The Passion of the Christ,6.9,864
12000000,4638,en,38.623178,2007-02-14,80573774,121.0,Released,Big cops. Small town. Moderate violence.,Hot Fuzz,7.4,2199
50000000,18239,en,94.815867,2009-03-15,709827462,130.0,Released,The Next Chapter Begins.,The Twilight Saga: New Moon,5.6,2436
105000000,257088,en,33.507289,2015-12-03,133718711,114.0,Released,The only law that matters is gravity,Point Break,5.5,783
0,21724,en,7.326034,2009-05-22,0,83.0,Released,,Dance Flick,4.7,71
0,18841,en,1.680525,2001-09-12,0,90.0,Released,No One Can Stand Its Mental Power!,The Lost Skeleton of Cadavra,6.5,30
0,35689,en,1.496454,2009-04-24,0,87.0,Released,Some secrets are better left buried.,Don McKay,5.4,21
3000000,20737,en,11.241802,1997-08-01,23144499,98.0,Released,He Sits. He Stays. He Shoots. He Scores.,Air Bud,5.3,106
0,39180,en,6.579017,2001-03-02,0,94.0,Released,The Smart One Isn't Wearing Any Pants.,See Spot Run,4.8,44
0,371085,en,0.027801,2015-01-01,0,0.0,Released,,Sharkskin,0.0,0
35000000,1381,en,24.606012,2006-09-06,15304890,96.0,Released,Death is the road to awe,The Fountain,6.8,827
19000000,8643,en,32.602868,2005-09-09,144216468,122.0,Released,What happened to Emily?,The Exorcism of Emily Rose,6.3,659
0,10071,en,8.312153,2007-09-07,0,93.0,Released,They want to put a baby in you.,The Brothers Solomon,4.9,46
12000000,11202,en,21.933822,1970-01-25,89800000,172.0,Released,The Rebel Warrior,Patton,7.3,323
40000000,10385,en,3.415534,2000-02-16,36037909,94.0,Released,Every family has a few hang-ups.,Hanging Up,5.0,40
18000000,10535,en,11.238522,1996-05-24,0,81.0,Released,All the action. All the women. Half the intelligence.,Spy Hard,4.9,147
400000,9659,en,33.142185,1979-04-12,100000000,93.0,Released,The Maximum Force Of The Future,Mad Max,6.6,1213
0,190847,en,18.764453,2013-08-11,0,98.0,Released,The search for life is about to end.,The Last Days on Mars,5.2,302
0,286939,en,0.166513,2012-01-20,0,82.0,Released,,Sanctuary: Quite a Conundrum,0.0,0
2300000,17820,en,1.606314,1951-07-13,11000000,107.0,Released,It's NEW!,Show Boat,6.9,18
12000000,10212,en,9.164386,1999-03-16,0,100.0,Released,You Are Who You Eat,Ravenous,6.9,141
10000000,15067,ko,11.847324,2008-07-16,0,130.0,Released,A Fistful of Fun!,"The Good, The Bad, The Weird",7.1,193
12000000,6020,en,3.444542,2002-03-22,0,93.0,Released,,Sorority Boys,4.6,47
53000000,8963,en,20.334629,1995-05-12,157387195,116.0,Released,Danger runs deep.,Crimson Tide,7.0,498
4638783,11577,en,4.495256,1973-05-23,11000000,106.0,Released,Best of enemies. Deadliest of friends.,Pat Garrett & Billy the Kid,7.2,65
0,20360,en,1.840511,2007-03-27,0,128.0,Released,,Namastey London,6.6,29
0,8435,en,3.500741,2005-07-17,0,94.0,Released,Because everyone loves an accurate period piece.,A Cock and Bull Story,6.2,43
15600000,35696,en,2.244947,2002-06-21,0,91.0,Released,,Juwanna Mann,4.2,20
18000000,11904,en,8.321586,1985-12-04,0,109.0,Released,"Before a lifetime of adventure, they lived the adventure of a lifetime.",Young Sherlock Holmes,6.7,167
100000,115210,en,7.447714,2012-05-19,95000,86.0,Released,You'll die laughing...,Stitches,5.5,92
100,268917,en,0.394575,2014-06-15,0,77.0,Released,,The Past Is a Grotesque Animal,5.5,2
0,66125,en,5.499412,2011-08-04,0,92.0,Released,He's Been Everywhere Mate.,Red Dog,7.1,83
65000000,41733,en,43.865294,2010-11-04,211780824,95.0,Released,Leave Your Comfort Zone,Due Date,6.2,1685
2700000,80,en,14.799323,2004-02-10,15992615,80.0,Released,What if you had a second chance with the one that got away?,Before Sunset,7.6,718
65000000,11983,en,14.866901,2000-12-08,0,135.0,Released,,Proof of Life,6.0,208
15000000,342521,en,18.268009,2016-04-21,20566327,94.0,Released,"Kitten, please.",Keanu,6.0,421
12000000,62204,xx,6.537986,1981-12-15,55260558,100.0,Released,,Quest for Fire,7.1,109
30000000,7512,en,27.940093,2006-09-01,495303,84.0,Released,"In the future, intelligence is extinct.",Idiocracy,6.3,664
0,44594,en,1.975941,2010-03-13,0,95.0,Released,A comedy that hits you right where it counts.,Barry Munday,6.3,22
21000000,9053,en,12.790408,2006-09-07,480314,87.0,Released,"They're the ultimate fighters. They've got the looks. They've got the moves, and the men fall at their feet.",DOA: Dead or Alive,5.0,205
17000000,109428,en,33.912116,2013-04-05,97542952,91.0,Released,The most terrifying film you will ever experience.,Evil Dead,6.4,1723
7000000,34653,en,21.626288,2009-10-19,0,101.0,Released,,A Single Man,7.3,463
32000000,45612,en,59.19888,2011-03-30,147332697,93.0,Released,Make Every Second Count,Source Code,7.1,2699
1000000,26791,en,0.280083,2001-03-30,852206,119.0,Released,,Brigham City,7.3,4
0,25212,en,2.171288,2000-03-10,0,101.0,Released,,Deterrence,6.1,7
28000000,4348,en,36.58383,2005-09-16,121147947,135.0,Released,A romance ahead of its time.,Pride & Prejudice,7.7,1358
55000000,58224,en,32.835777,2011-06-17,187361754,94.0,Released,,Mr. Popper's Penguins,5.7,751
1800000,377,en,38.204158,1984-11-14,25504513,91.0,Released,"If Nancy Doesn't Wake Up Screaming, She Won't Wake Up At All!",A Nightmare on Elm Street,7.2,1180
20000000,81796,en,35.232278,2012-04-12,32204030,95.0,Released,Take no prisoners.,Lockout,5.8,715
0,15394,en,8.045488,2003-05-02,0,104.0,Released,To some it's a game. To others it's a habit. But to Dan Mahowny -- beating the odds is everything,Owning Mahowny,6.8,37
0,24747,en,2.897449,2004-04-30,0,120.0,Released,,Bobby Jones: Stroke of Genius,5.5,19
30000000,1262,en,32.26789,2006-09-09,53653224,113.0,Released,Harold Crick isn't ready to go. Period.,Stranger Than Fiction,7.1,721
0,26963,en,10.621353,2009-02-09,0,75.0,Released,Turn the darkness into light,The Secret of Kells,7.3,181
0,157354,en,20.967146,2013-07-25,17385830,85.0,Released,Every step brings you closer to the edge,Fruitvale Station,7.3,390
17000000,333348,en,9.191187,2015-11-12,24000000,107.0,Released,"Christmas means comfort, joy and chaos.",Love the Coopers,5.4,167
135000000,228161,en,63.473086,2015-03-18,368871007,94.0,Released,Worlds Collide,Home,6.8,1519
90000000,9822,en,6.643778,1998-12-25,0,114.0,Released,Survival is an instinct.,Mighty Joe Young,5.9,208
23000000,10663,en,23.839127,1998-11-06,185991646,90.0,Released,You can mess with him. But don't mess with his water.,The Waterboy,5.9,512
500000,84401,en,0.109579,2012-02-24,845188,93.0,Released,"Before there was Fiddler, there was Tevye... and the man who created him.",Sholem Aleichem: Laughing In The Darkness,7.0,2
0,181940,en,0.006069,2007-07-20,0,103.0,Released,,Carousel of Revenge,0.0,0
20000000,59860,en,17.237143,2011-07-01,17425000,109.0,Released,She's having the time of someone else's life.,Monte Carlo,6.0,593
6000000,13537,en,6.27257,2003-11-14,2944752,94.0,Released,,Shattered Glass,6.6,111
28000000,162903,en,20.267062,2013-10-11,8555008,128.0,Released,You can't expose the world's secrets without exposing yourself,The Fifth Estate,5.7,364
250000000,767,en,98.885637,2009-07-07,933959197,153.0,Released,Dark Secrets Revealed,Harry Potter and the Half-Blood Prince,7.4,5293
21000000,31005,en,8.982335,2002-09-09,10011050,117.0,Released,,Moonlight Mile,6.5,52
50000000,274167,en,38.616744,2015-12-25,242786137,96.0,Released,Choose your Daddy,Daddy's Home,5.8,854
200000000,58,en,145.847379,2006-06-20,1065659812,151.0,Released,Jack is back!,Pirates of the Caribbean: Dead Man's Chest,7.0,5246
10000000,55720,en,4.123533,2011-06-24,1759252,98.0,Released,Every father wants more for his son.,A Better Life,7.0,54
57000000,6073,en,21.021809,2001-03-01,147845033,123.0,Released,Love with the safety off.,The Mexican,5.8,441
27000000,9825,en,11.678561,1999-07-15,56870414,82.0,Released,You'll never know what bit you.,Lake Placid,5.5,247
20000000,16690,en,15.341196,2002-02-14,109862682,72.0,Released,The Classic Continues,Return to Never Land,6.1,290
30000000,76640,en,43.882857,2013-01-12,0,107.0,Released,Not in his town. Not on his watch.,The Last Stand,5.7,1266
20000000,840,en,52.456505,1977-11-16,303788635,135.0,Released,We are not alone.,Close Encounters of the Third Kind,7.2,1098
0,56930,en,0.042442,1947-12-27,0,128.0,Released,Breath-taking Adventure !,Tycoon,6.6,4
8000000,10873,en,5.93923,2000-05-15,8279017,92.0,Released,An Unspeakable Horror. A Creative Genius. Captured For Eternity.,Shadow of the Vampire,6.6,148
11000000,14877,en,3.646848,2007-05-17,0,110.0,Released,,September Dawn,5.0,16
14000000,859,en,14.480628,1988-12-16,34670720,119.0,Released,Lust. Seduction. Revenge. The Game As You've Never Seen It Played Before.,Dangerous Liaisons,7.0,257
250000,60420,en,21.825564,2011-10-28,3542353,90.0,Released,I Want You. I Need You. I Love You. I Miss You.,Like Crazy,6.4,381
7500000,7735,de,25.281197,2008-03-11,19000000,107.0,Released,Evil is something that you learn,The Wave,7.5,841
95000000,10501,en,37.054554,2000-03-31,76432727,89.0,Released,They came for the gold... they stayed for the adventure.,The Road to El Dorado,7.0,858
35000000,8090,en,12.677505,2008-01-22,32483410,101.0,Released,A cyber killer has finally found the perfect accomplice: You.,Untraceable,5.9,238
18000000,20483,en,4.492859,2004-02-06,16702864,92.0,Released,They're on a mission without permission.,Catch That Kid,4.9,76
15000000,253450,zh,8.142166,2015-08-27,632542,105.0,Released,,The Assassin,6.6,157
3000000,284,en,22.889294,1960-06-15,25000000,125.0,Released,"Movie-wise, there has never been anything like it - laugh-wise, love-wise, or otherwise-wise!",The Apartment,8.1,483
16000000,218043,en,33.452469,2014-10-03,19682924,110.0,Released,The End Begins,Left Behind,3.7,392
35000000,257211,en,53.114573,2015-09-24,194564672,121.0,Released,Experience never gets old,The Intern,7.1,1881
20000000,10678,en,8.351385,2003-03-07,132675402,105.0,Released,"Everything he needed to know about life, she learned in prison.",Bringing Down the House,5.4,183
25000000,8988,en,4.002579,2008-03-28,11207130,113.0,Released,The bravest place to stand is by each other's side.,Stop-Loss,6.1,82
45000000,1577,en,29.880122,2004-09-10,129394835,94.0,Released,You're all going to die.,Resident Evil: Apocalypse,6.1,1267
85000000,76492,en,56.257411,2012-09-20,358375603,91.0,Released,Where monsters go to get away from it all,Hotel Transylvania,6.8,2566
13000000,3682,en,11.880899,1998-08-28,16757163,106.0,Released,You've never been anywhere until you've been here,54,5.5,135
0,13193,en,9.85123,2004-01-21,0,92.0,Released,,Saved!,6.3,147
30000000,124459,en,26.9385,2013-03-14,27437881,100.0,Released,Abracatastic!,The Incredible Burt Wonderstone,5.3,724
0,125123,en,0.541652,1998-06-24,0,93.0,Released,"a love story from the writer of ""The Full Monty"".",Among Giants,4.5,2
0,188652,en,0.209475,2013-04-26,0,106.0,Released,They Sing! They Dance! They're Juvenile Delinquents from Outer Space!,The Ghastly Love of Johnny X,6.6,8
12000000,31915,en,8.61659,1979-01-01,54000000,102.0,Released,,Prophecy,5.4,25
90000000,76285,en,40.262261,2013-08-07,174578751,106.0,Released,"Where There Are Gods, There Are Monsters.",Percy Jackson: Sea of Monsters,5.9,1648
110000000,163,en,76.840712,2004-12-09,362744280,125.0,Released,Twelve is the new eleven.,Ocean's Twelve,6.4,2124
74000000,211672,en,875.581305,2015-06-17,1156730962,91.0,Released,"Before Gru, they had a history of bad bosses",Minions,6.4,4571
0,281189,en,0.033883,2003-11-05,0,0.0,Released,,Gory Gory Hallelujah,1.0,1
0,11190,ru,7.744166,2003-06-25,0,105.0,Released,,The Return,7.4,100
68000000,11371,en,22.572323,2001-07-13,71069884,124.0,Released,There are no partners in crime,The Score,6.7,423
75000000,37821,en,23.004607,2010-06-04,98159963,100.0,Released,Perfect wife. Perfect target.,Killers,5.7,772
48000000,9607,en,14.587367,1993-05-28,20915465,104.0,Released,This Ain't No Game.,Super Mario Bros.,4.0,232
18000000,245703,en,32.717853,2016-02-18,6212282,112.0,Released,He's not like us.,Midnight Special,6.2,694
149000000,11619,en,22.550135,2006-10-22,64459316,85.0,Released,Someone's Going Down,Flushed Away,6.0,874
34000000,228205,en,41.946523,2015-04-09,63013281,128.0,Released,Two couples. Two love stories. One epic tale.,The Longest Ride,7.3,1064
11000000,22804,en,31.900899,2009-10-22,68233629,90.0,Released,The Game Has Come Full Circle,Saw VI,6.0,722
4400000,362105,en,3.898737,2015-09-29,0,85.0,Released,,R.L. Stine's Monsterville: The Cabinet of Souls,6.9,35
7400000,62215,da,36.173598,2011-05-26,21817298,136.0,Released,Enjoy it while it lasts,Melancholia,7.0,885
4000000,20065,en,0.936232,2007-04-30,0,103.0,Released,A second chance for a first love.,Purple Violets,5.7,9
20000000,226857,en,27.256849,2014-02-12,34077920,103.0,Released,Say Goodbye to Innocence,Endless Love,6.7,542
31000000,296099,en,47.753598,2015-07-28,104384188,99.0,Released,What could go wrong?,Vacation,6.2,1195
11500000,1245,en,15.355589,1993-11-05,23237911,134.0,Released,Diamond in the Rough,The Remains of the Day,7.5,202
55000000,8195,en,32.657488,1998-09-25,41610884,122.0,Released,Your ally could become your enemy.,Ronin,6.7,658
0,17186,en,3.71305,2005-08-16,3102550,80.0,Released,,Supercross,5.4,29
1350000,100,en,16.032594,1998-03-05,3897569,105.0,Released,A Disgrace to Criminals Everywhere.,"Lock, Stock and Two Smoking Barrels",7.5,1648
4000000,5,en,22.87623,1995-12-09,4300000,98.0,Released,"Twelve outrageous guests. Four scandalous requests. And one lone bellhop, in his first day on the job, who's in for the wildest New year's Eve of his life.",Four Rooms,6.5,530
25100000,10523,en,10.445391,2008-10-17,29506464,131.0,Released,A life misunderestimated.,W.,6.1,143
3500000,39303,en,1.271621,2009-04-25,0,96.0,Released,Killers Are Not Born ... They Are Made,2:13,4.6,10
25000000,11954,en,12.18362,1985-06-20,0,116.0,Released,"In the blink of an eye, the terror begins.",Lifeforce,6.2,135
0,22908,en,1.391958,1999-08-23,0,90.0,Released,,A Room for Romeo Brass,7.3,18
80000000,4858,en,15.673154,2007-08-17,15071514,99.0,Released,Do not trust anyone. Do not show emotion. Do not fall asleep.,The Invasion,5.7,359
0,22913,en,0.744406,1997-08-31,0,96.0,Released,,24 7: Twenty Four Seven,6.3,10
800000,60243,fa,12.049373,2011-03-15,0,123.0,Released,"Ugly truth, sweet lies.",A Separation,7.7,469
5000000,17339,en,5.348446,1978-11-01,7230000,118.0,Released,,Force 10 from Navarone,6.4,91
11000000,121826,en,7.722021,2012-09-08,59520298,98.0,Released,Four Friends Looking For A Little Harmony,Quartet,6.3,139
8000000,389425,en,2.101718,2016-05-06,0,106.0,Released,There is no honor in revenge.,Code of Honor,4.1,16
60000000,137094,en,42.538258,2014-01-15,50549107,105.0,Released,Trust no one.,Jack Ryan: Shadow Recruit,5.9,1173
13000000,107811,en,35.522027,2013-03-01,48065672,93.0,Released,Finally.,21 & Over,5.7,737
14000000,142,en,44.135568,2005-09-02,178043761,134.0,Released,Love is a force of nature.,Brokeback Mountain,7.5,1480
25000000,64639,en,7.473455,2011-09-16,10324441,110.0,Released,Everyone Has A Breaking Point,Straw Dogs,5.5,144
75000000,3172,en,24.353302,2001-10-12,67631903,123.0,Released,"Two's company, three's a crime.",Bandits,6.2,302
0,11546,en,11.946898,1994-06-09,126247,83.0,Released,"Just when we thought the Cold War was over, leave it to these guys to heat it up again.",Police Academy: Mission to Moscow,4.1,178
10000000,9289,en,19.524972,1962-09-25,50100000,178.0,Released,This is the day that changed the world... When history held its breath.,The Longest Day,7.2,234
27000000,865,en,30.131498,1987-11-13,38122105,101.0,Released,A game nobody survives. But Schwarzenegger has yet to play.,The Running Man,6.4,703
0,22617,en,1.096355,2000-09-01,0,99.0,Released,,Dinner Rush,7.1,19
12000000,26466,en,25.496926,2009-10-16,0,99.0,Released,A Passage to Hell,Triangle,6.9,612
5000000,13090,en,19.336367,2008-01-18,16174377,102.0,Released,life's a messy business.,Sunshine Cleaning,6.5,255
88000000,4442,en,40.138009,2005-08-26,105316267,118.0,Released,Eliminating Evil Since 1812.,The Brothers Grimm,5.6,818
8000000,13079,en,9.728143,2007-09-08,0,90.0,Released,Your life can change in an instant. That instant can last forever.,The Life Before Her Eyes,6.1,88
40000000,100042,en,67.767785,2014-11-12,169837010,110.0,Released,The Second Parts Are More Fools,Dumb and Dumber To,5.4,1127
55000000,9275,en,11.329727,2002-03-28,0,109.0,Released,Get ready for an unexpected hit.,Death to Smoochy,5.9,132
858000,3170,en,47.651878,1942-08-14,267447150,70.0,Released,A great love story.,Bambi,6.8,1405
0,40963,en,0.0921,2006-01-01,0,0.0,Rumored,,Little Big Top,10.0,1
20000000,9582,en,5.596835,2003-01-17,17432163,101.0,Released,Boy meets girl. Boy meets girl's cousin.,A Guy Thing,5.3,83
70000000,612,en,29.035222,2005-12-22,130358911,164.0,Released,The world was watching in 1972 as 11 Israeli athletes were murdered at the Munich Olympics. This is the story of what happened next.,Munich,6.9,696
1500000,10707,en,13.788054,2005-10-05,11098131,81.0,Released,Joint custody blows.,The Squid and the Whale,6.9,226
25000000,866,en,34.160448,2004-10-17,116766556,106.0,Released,Where will your imagination take you?,Finding Neverland,7.2,1223
0,127918,en,2.828303,2012-07-09,0,101.0,Released,,The Gatekeepers,6.5,39
6400000,218,en,74.234793,1984-10-26,78371200,108.0,Released,Your future is in his hands.,The Terminator,7.3,4128
85000000,62764,en,48.126297,2012-03-15,183018522,106.0,Released,The Snow White legend comes alive.,Mirror Mirror,5.5,1114
40000000,27582,en,44.094856,2011-01-13,51070807,93.0,Released,Someone has to fix the problems.,The Mechanic,6.3,1045
0,8981,en,3.11319,2004-05-18,0,105.0,Released,,Dear Frankie,7.0,46
139000000,557,en,82.502566,2002-05-01,821708551,121.0,Released,With great power comes great responsibility.,Spider-Man,6.8,5265
0,13156,en,15.011624,2003-09-19,0,111.0,Released,,Secondhand Lions,6.9,260
0,63006,hi,0.075817,2011-04-22,0,130.0,Released,Goa. Paradise on Earth. But every Paradise has a few snakes.,Dum Maaro Dum,5.4,7
40000000,841,en,25.876582,1984-12-14,30925690,137.0,Released,"A world beyond your experience, beyond your imagination.",Dune,6.5,562
5000000,12484,en,2.739307,2001-04-27,0,90.0,Released,The night... has an appetite.,The Forsaken,4.9,47
53000000,9444,en,45.565918,1997-11-20,139804348,94.0,Released,Discover the Adventure Behind the Greatest Mystery of Our Time.,Anastasia,7.4,1432
35000000,14846,en,6.246199,2004-08-06,22034832,111.0,Released,Have you ever been tempted to look inside his...,Little Black Book,5.2,112
12000000,7510,en,4.770195,2006-10-27,6754898,116.0,Released,Ever have one of those lives?,Running with Scissors,5.8,78
8000000,23570,en,2.149469,1996-05-03,0,97.0,Released,Something magical is about to unfold in the most unexpected place.,The Pallbearer,4.6,30
0,37232,en,0.749699,2003-09-09,0,108.0,Released,The bitter and the sweet of temporary things.,Travellers and Magicians,6.8,9
12000000,11027,en,6.803763,1981-03-20,0,122.0,Released,You Will Feel The Heat,The Postman Always Rings Twice,6.4,110
43000000,9913,en,29.105407,2005-07-29,91974818,104.0,Released,Fearing Is Believing,The Skeleton Key,6.4,573
110000000,254128,en,100.412364,2015-05-27,470490832,114.0,Released,"A rescue pilot survived an earthquake, this is what happens next",San Andreas,6.0,2968
25000000,50014,en,42.191509,2011-08-09,124272124,146.0,Released,Change begins with a whisper.,The Help,7.8,1910
20000,36095,ja,0.212443,1997-11-06,99000,111.0,Released,Madness. Terror. Murder.,Cure,7.4,63
7,13006,en,4.857028,1992-05-01,5,90.0,Released,He's seen the future. Now he has to kill it.,Split Second,5.7,63
