budget,id,original_language,popularity,release_date,revenue,runtime,status,tagline,title,vote_average,vote_count
21000000,2575,en,7.047975,2001-02-11,28008462,109.0,Released,"In a place this treacherous, what a good spy needs is a spy of his own.",The Tailor of Panama,6.2,92
26000000,9454,en,21.988861,1998-07-31,65705772,121.0,Released,Desire. Defy. Escape.,Ever After: A Cinderella Story,6.8,399
25000000,41630,en,38.688822,2011-01-21,147780440,107.0,Released,Friendship has its benefits.,No Strings Attached,6.1,1331
65000000,5551,en,15.772081,2000-07-31,128884132,130.0,Released,Space will never be the same.,Space Cowboys,6.3,403
33000000,37498,en,2.706207,1998-09-04,0,91.0,Released,There is no substitute.,Knock Off,4.7,64
90000000,9679,en,52.995628,2000-06-09,237202299,118.0,Released,"Ice Cold, Hot Wired.",Gone in Sixty Seconds,6.1,1485
130000000,101299,en,76.310119,2013-11-15,847423452,146.0,Released,Every revolution begins with a spark.,The Hunger Games: Catching Fire,7.4,6495
0,16186,en,3.784535,2005-02-25,0,116.0,Released,Time heals the heart. Faith heals the rest.,Diary of a Mad Black Woman,6.4,71
16000000,49950,en,11.807269,2011-02-04,40492759,91.0,Released,"2,000 colleges. 8 million roommates. Which one will you get?",The Roommate,5.3,224
950000,29146,en,0.178689,1968-09-23,814666,103.0,Released,A love story that begins with an incredible experiment!,Charly,6.6,28
8000000,10734,en,26.356697,1979-06-22,43000000,111.0,Released,No one has ever escaped from Alcatraz...and no one ever will!,Escape from Alcatraz,7.2,561
27000000,8831,en,13.308127,1994-09-15,101646581,99.0,Released,They killed his wife ten years ago. There's still time to save her. Murder is forever... until now.,Timecop,5.5,282
34000000,698,en,29.887404,1979-06-26,210308099,126.0,Released,Outer space now belongs to 007.,Moonraker,5.9,541
0,41382,en,9.054803,2010-08-20,0,99.0,Released,Winning is Just the Beginning Surviving is Another Story,Lottery Ticket,5.6,54
0,93856,en,20.649145,2012-05-24,18112929,88.0,Released,Experience the fallout,Chernobyl Diaries,4.9,483
0,52010,en,3.891186,2010-12-10,0,76.0,Released,In the grim darkness of the far future there is only war,"Ultramarines: A Warhammer 40,000 Movie",5.2,27
8000000,12192,en,9.782433,2008-04-11,0,95.0,Released,No body is safe.,Pathology,5.6,144
7000000,12400,en,5.091253,2008-04-07,0,99.0,Released,There's always a way out. You just have to find it.,Redbelt,6.4,76
65000000,59962,en,38.994297,2012-02-14,156974557,103.0,Released,It's SPY Against SPY,This Means War,5.9,1389
75000000,10590,en,19.708731,2002-03-01,114660784,138.0,Released,400 U.S paratroopers. 4000 Vietnamese soldiers. 12 000 miles away from home. 1 man led them into battle.,We Were Soldiers,6.7,521
23000000,14844,en,3.362045,2004-01-09,12,111.0,Released,How do you fall in love with the whole world watching?,Chasing Liberty,6.1,152
82500000,9339,en,41.176631,2006-06-22,237681299,107.0,Released,What If You Had A Remote... That Controlled Your Universe?,Click,6.0,2104
0,10727,en,11.199544,2003-01-24,0,86.0,Released,Evil rises.,Darkness Falls,4.9,161
52000000,26389,en,27.916284,2010-02-05,52826594,92.0,Released,Two agents. One city. No merci.,From Paris with Love,6.1,675
95000000,9342,en,31.086791,1998-07-16,250288523,136.0,Released,No one has seen his face... but everyone ... knows this mark.,The Mask of Zorro,6.3,1183
0,111794,en,0.408073,1998-01-01,0,87.0,Released,A comedy so real you'll think it's fiction.,20 Dates,3.7,3
19000000,9737,en,33.872182,1995-04-07,141407024,118.0,Released,Whatcha gonna do?,Bad Boys,6.5,1699
30000000,184346,en,29.359201,2014-07-01,0,118.0,Released,,Deliver Us from Evil,5.9,690
35000000,10054,en,21.543389,2001-03-18,147934180,88.0,Released,Real spies...only smaller,Spy Kids,5.5,867
126000000,1635,en,37.68056,2005-07-20,162949164,136.0,Released,Your time will come...,The Island,6.5,1770
5000000,244403,en,10.619574,2014-10-17,0,105.0,Released,The way back begins with a single chord.,Rudderless,7.4,105
10000000,18516,en,2.574014,2008-08-08,0,106.0,Released,,Adam Resurrected,6.4,22
100000000,18162,en,19.38841,2009-06-05,68688831,102.0,Released,Right place. Wrong time.,Land of the Lost,5.3,381
23000000,152601,en,53.682367,2013-12-18,47351251,126.0,Released,A Spike Jonze Love Story,Her,7.9,4097
27500000,5125,en,12.741073,2007-09-07,24748670,120.0,Released,What if someone you love...just disappeared?,Rendition,6.2,205
35000000,13490,en,6.248273,2008-02-08,43650785,114.0,Released,"Roscoe Jenkins aims for the heartstrings and funny bones, a raucous helping of family soul food.",Welcome Home Roscoe Jenkins,5.7,57
0,45958,es,13.930763,2010-10-20,25147786,148.0,Released,"You don't choose your family. We all belong to somebody, but to belong to Uxbal and Marambra, is both a blessing and a curse.",Biutiful,7.0,291
70000000,9882,en,20.089933,1998-11-06,116672912,116.0,Released,On November 6th our freedom is history,The Siege,6.0,352
2600000,14139,es,19.02965,2007-09-20,553198,92.0,Released,A trip back in time from the present to...,Timecrimes,7.0,308
50100000,256591,en,59.634029,2015-02-25,153962963,105.0,Released,Never Drop The Con.,Focus,6.7,2542
6600000,57119,en,4.492455,2011-05-06,37710610,112.0,Released,Sometimes the only way to get past family drama... is to jump right over it.,Jumping the Broom,6.0,56
0,158895,en,0.76368,2013-06-28,0,83.0,Released,Sometimes You Have to Lose Your Life in Order to Find It,This Is Martin Bonner,6.6,4
50000000,2649,en,62.925175,1997-09-12,109423648,129.0,Released,What do you get for the man who has everything?,The Game,7.5,1506
60000,473,en,27.788067,1998-07-10,3221152,84.0,Released,"There will be no order, only chaos",Pi,7.1,586
150000000,177677,en,114.522237,2015-07-23,682330139,131.0,Released,Desperate Times. Desperate Measures.,Mission: Impossible - Rogue Nation,7.1,3224
5000000,11843,en,6.470766,1975-05-21,41833347,113.0,Released,,The Return of the Pink Panther,6.7,137
3500000,370662,en,1.618138,2015-09-04,0,100.0,Released,Climate change for good.,Time to Choose,0.0,0
40000000,76494,en,27.009723,2012-05-17,79700000,110.0,Released,It's too late to pull out now.,What to Expect When You're Expecting,5.8,594
11000000,42345,en,1.396985,1970-01-27,2200000,124.0,Released,,The Molly Maguires,5.9,16
0,6537,es,29.071955,2007-08-27,44000000,105.0,Released,A tale of love.  A story of horror.,The Orphanage,7.1,633
32000000,9294,en,15.039407,1996-07-05,152036382,123.0,Released,Some things in life just can't be explained.,Phenomenon,6.2,323
0,13569,en,1.946715,2006-12-01,0,101.0,Released,,Thr3e,4.8,21
93000000,61791,en,138.433168,2011-08-03,482860185,105.0,Released,Evolution Becomes Revolution.,Rise of the Planet of the Apes,7.0,4347
0,67238,en,0.022173,2005-03-12,0,80.0,Released,,Cavite,7.5,2
0,16016,en,1.776624,2008-09-26,0,90.0,Released,,Journey to Saturn,4.9,10
120000000,50620,en,99.687084,2012-11-13,829000000,115.0,Released,The epic finale that will live forever,The Twilight Saga: Breaking Dawn - Part 2,6.1,2553
24000000,10208,en,6.589193,1999-07-14,16290976,87.0,Released,Space. It's not as deep as you think.,Muppets from Space,5.8,92
47000000,55779,en,38.555482,2011-08-12,157887643,92.0,Released,We all share a common destination.,Final Destination 5,5.9,866
70000000,17709,en,8.792054,1999-08-27,0,77.0,Released,From the creator of 'George of the Jungle' comes a new kind of hero,Dudley Do-Right,3.8,48
55000000,70074,en,22.503935,2013-01-31,9489829,92.0,Released,Revenge Never Gets Old.,Bullet to the Head,5.2,481
15000000,20083,zh,5.294319,2009-03-22,0,119.0,Released,They destroyed his life... Now he'll destroy them all.,Shinjuku Incident,6.7,65
0,24363,en,6.337735,2005-04-15,0,97.0,Released,,House of D,6.1,23
45000000,82525,en,31.856589,2012-07-06,82966152,131.0,Released,Young Beautiful Deadly.,Savages,6.2,766
50000000,7453,en,51.742065,2005-01-15,104478416,109.0,Released,Don't leave Earth without it.,The Hitchhiker's Guide to the Galaxy,6.6,1315
0,11162,en,12.467267,2004-09-03,0,138.0,Released,,The Merchant of Venice,6.7,144
14000000,12227,en,13.13724,1991-01-18,34793160,107.0,Released,"Where civilization ends, their journey begins.",White Fang,6.5,135
1493619,246449,en,2.492747,2013-12-29,0,90.0,Released,Partners in survival. Friends for life.,Against the Wild,4.9,19
0,9647,en,21.620317,1988-11-22,60328000,101.0,Released,The spirits will move you in odd and hysterical ways.,Scrooged,6.7,390
250000000,49026,en,112.31295,2012-07-16,1084939099,165.0,Released,The Legend Ends,The Dark Knight Rises,7.6,9106
40000000,8224,en,25.580272,1999-02-26,96618699,123.0,Released,You can't prepare for where the truth will take you.,8MM,6.1,474
2000000,92182,en,11.66632,2011-01-21,13101672,85.0,Released,"Experience 88 minutes of real fear, captured In real time",Silent House,5.2,125
8000000,374461,en,7.828459,2016-09-16,0,104.0,Released,He was the one person she could always count on.,Mr. Church,7.0,129
25000000,293646,en,10.699952,2015-08-06,24902723,120.0,Released,Hope Runs Deep,The 33,6.0,378
0,171759,en,2.952932,2013-03-01,0,97.0,Released,Finding it is only the beginning.,The Lost Medallion: The Adventures of Billy Stone,5.6,13
0,48035,da,3.225189,1955-01-09,0,126.0,Released,,Ordet,7.8,65
20000000,13948,en,2.605374,2008-10-03,7000000,83.0,Released,Laugh like you're country depends on it.,An American Carol,4.1,20
13000000,47502,en,1.647335,1996-04-03,9789900,91.0,Released,"A comedy about a wife, her husband and his hit man.",Faithful,4.8,4
63000000,329,en,40.413191,1993-06-11,920100000,127.0,Released,An adventure 65 million years in the making.,Jurassic Park,7.6,4856
0,36811,en,3.659292,2009-09-04,0,112.0,Released,Intoxicating. Infuriating. Impossible. Love.,The Last Station,6.7,55
3500000,8408,en,18.025206,1985-07-19,34000000,96.0,Released,The darkest day of horror the world has ever known.,Day of the Dead,6.9,270
0,25678,en,5.061107,1987-05-01,0,90.0,Released,,American Ninja 2: The Confrontation,4.9,49
165000000,47933,en,48.775723,2016-06-22,389681935,120.0,Released,We had twenty years to prepare. So did they.,Independence Day: Resurgence,4.9,2491
0,244339,cn,1.583918,2013-03-10,0,107.0,Released,,Out of Inferno,5.8,11
0,245700,en,9.242554,2014-10-31,5405500,150.0,Released,,Mr. Turner,6.3,204
1800000,542,es,2.179428,2002-10-01,0,118.0,Released,Lead us not into temptation,The Crime of Padre Amaro,6.2,36
6000000,712,en,29.834065,1994-03-09,254700832,117.0,Released,Five good reasons to stay single.,Four Weddings and a Funeral,6.6,632
11000000,86829,en,36.319205,2013-10-06,32935319,105.0,Released,,Inside Llewyn Davis,7.2,834
560000,704,en,10.730056,1964-07-06,12299668,88.0,Released,"The Beatles, starring in their first full-length, hilarious, action-packed film!",A Hard Day's Night,7.3,168
0,11137,en,17.943945,2004-03-28,0,111.0,Released,Finding your inner princess can be such a royal pain.,The Prince & Me,5.9,278
80000000,11665,en,23.496054,2008-06-19,230685453,110.0,Released,Saving The World...And Loving It!,Get Smart,6.0,1051
50000000,2116,en,14.993459,2003-10-03,55495563,105.0,Released,The Clock Is Ticking...,Out of Time,6.1,298
23000000,854,en,85.30318,1994-07-29,351583407,101.0,Released,From zero to hero.,The Mask,6.6,2472
17000000,255343,en,25.112567,2014-10-11,3758328,120.0,Released,Welcome to the family,Escobar: Paradise Lost,6.1,271
5000000,252680,en,10.274542,2014-03-25,10429707,98.0,Released,What could go wrong?,Moms' Night Out,5.5,121
0,16858,en,5.159407,1979-12-20,37823676,123.0,Released,All that work. All that glitter. All that pain. All that love. All that crazy rhythm. All that jazz.,All That Jazz,7.3,85
0,241257,en,27.215666,2015-10-01,17671101,106.0,Released,Fear always finds its victim,Regression,5.3,585
0,323270,en,0.392658,2015-10-27,0,0.0,Released,,The Horror Network Vol. 1,5.0,2
103000000,98,en,95.301296,2000-05-01,457640427,155.0,Released,A Hero Will Rise.,Gladiator,7.9,5439
0,256687,en,2.214925,2014-04-20,0,96.0,Released,Greed. Revenge. Redemption.,Swelter,4.6,21
47000000,9095,en,6.067212,1996-02-23,12379402,104.0,Released,The untold story of Jekyll and Hyde,Mary Reilly,5.7,74
6500000,76025,en,40.688426,2011-10-02,17693675,100.0,Released,,Shame,7.0,875
25000000,9903,en,5.073536,2006-10-14,11772461,116.0,Released,Never let the truth get in the way of a good story.,The Hoax,6.4,60
3000000,292,en,1.697846,2005-09-12,11718595,100.0,Released,,Dave Chappelle's Block Party,6.4,28
50000000,10400,en,20.825781,1999-09-17,73956241,146.0,Released,His greatest fight was for justice.,The Hurricane,7.2,396
5000000,245916,en,21.343093,2014-10-09,2450846,112.0,Released,Can you keep a national secret?,Kill the Messenger,6.6,355
0,28665,en,7.668063,2009-01-01,0,107.0,Released,,Fame,5.5,135
92620000,19,de,32.351527,1927-01-10,650422,153.0,Released,There can be no understanding between the hands and the brain unless the heart acts as mediator.,Metropolis,8.0,657
0,55567,en,0.305922,2010-07-16,531826,105.0,Released,Dance - Sing - Dream,Standing Ovation,3.9,6
0,13066,en,1.742383,2006-01-01,0,80.0,Released,,I Want Someone to Eat Cheese With,5.7,12
6000000,642,en,24.499996,1969-09-23,102308889,110.0,Released,"Not that it matters, but most of it is true.",Butch Cassidy and the Sundance Kid,7.4,650
63000000,1852,en,24.697533,2006-08-09,162945894,128.0,Released,The world saw evil that day. Two men saw something else.,World Trade Center,5.9,447
42000000,227159,en,82.185281,2014-11-26,107670357,108.0,Released,New Crime. Same Tools.,Horrible Bosses 2,6.1,1536
0,29064,en,1.288173,1999-10-15,2400000,100.0,Released,,The Omega Code,4.4,17
4000000,215,en,42.187986,2005-10-28,152925093,92.0,Released,Oh Yes... There Will Be Blood.,Saw II,6.3,1251
150000000,18360,en,81.781591,2009-05-20,413106170,105.0,Released,When the lights go off the battle is on.,Night at the Museum: Battle of the Smithsonian,5.9,1971
32000000,709,en,28.22119,1989-07-07,156167015,133.0,Released,His bad side is a dangerous place to be.,Licence to Kill,5.9,541
0,4107,en,7.330691,2002-01-16,773228,107.0,Released,,Bloody Sunday,7.2,53
40000000,11551,en,23.088571,1998-07-10,54682547,110.0,Released,"The few, the proud, and the small.",Small Soldiers,6.2,511
1000000,46727,en,0.340019,1999-02-11,0,104.0,Released,There's no place for dreams on the streets of Vegas,Speedway Junky,5.2,7
32000000,11637,en,13.590677,2005-01-20,97918663,95.0,Released,24 hours. 350 miles. His girlfriend's kids. What could possibly go wrong?,Are We There Yet?,5.2,221
0,25769,en,12.708963,2009-09-04,5802422,84.0,Released,"The rules are simple. You break them, you die...",Carriers,5.8,282
70000000,10550,en,8.37378,2002-09-20,19924033,91.0,Released,,Ballistic: Ecks vs. Sever,4.3,97
3300000,301748,en,2.964785,2014-11-08,45000,96.0,Released,"A battle of the sexes, winner takes all.",The Opposite Sex,4.1,9
17500000,205,en,28.60542,2004-09-11,38000000,121.0,Released,"When the world closed its eyes, he opened his arms.",Hotel Rwanda,7.5,793
10,217708,is,1.617943,2013-08-30,11,85.0,Released,,Of Horses and Men,6.9,26
7000000,13685,en,11.700578,1996-02-21,560069,91.0,Released,"They're not really criminals, but everyone's got to have a dream.",Bottle Rocket,6.8,281
19800000,239678,en,20.311684,2014-09-10,41296320,103.0,Released,Welcome Home. Get Uncomfortable.,This Is Where I Leave You,6.5,505
45000000,9899,en,6.803965,2005-12-25,38058335,134.0,Released,,The Producers,6.1,151
55000000,175574,en,14.414937,2013-10-30,110000000,91.0,Released,Hang On To Your Nuggets,Free Birds,5.7,254
0,270554,en,0.053755,2013-11-08,0,85.0,Released,To Serve & Terminate,Echo Dr.,5.0,1
0,37737,en,4.807549,2010-05-21,0,131.0,Released,,Kites,6.0,40
4500000,9303,en,15.359952,1996-09-13,7011317,108.0,Released,"In their world, you can't buy freedom, but you can steal it.",Bound,6.9,198
75000000,8970,en,4.842626,1999-04-02,29000000,90.0,Released,"They fell in love 24 years ago... and in the next 24 hours, they'll remember why.",The Out-of-Towners,5.0,45
17000000,114150,en,32.746486,2012-09-28,115350426,112.0,Released,Get pitch slapped.,Pitch Perfect,7.3,2247
9500000,667,en,28.675891,1967-06-12,111584787,117.0,Released,You Only Live Twice...and Twice is the only way to live!,You Only Live Twice,6.5,531
100000000,11688,en,51.113717,2000-12-09,169327687,78.0,Released,It's All About.....ME!,The Emperor's New Groove,7.2,1490
23000000,9532,en,38.799596,2000-03-16,53302314,98.0,Released,No accidents. No coincidences. No escapes. You can't cheat death.,Final Destination,6.4,1378
2000000,990,en,17.639478,1961-09-25,7600000,134.0,Released,They called him Fast Eddie. He was a winner. He was a loser. He was a hustler.,The Hustler,7.6,240
150000000,10527,en,44.141021,2008-10-30,603900354,89.0,Released,Still together. Still lost!,Madagascar: Escape 2 Africa,6.2,1810
62000000,9087,en,11.056763,1995-11-17,107879496,106.0,Released,Why can't the most powerful man in the world have the one thing he wants most?,The American President,6.5,195
11000000,17708,en,3.495758,2001-10-12,23978402,86.0,Released,Undercover and Out The Way!,Corky Romano,4.1,54
2000000,16608,en,14.617944,2005-10-06,5048693,104.0,Released,This land will be civilized.,The Proposition,7.1,218
55000000,10632,en,8.634954,2003-03-11,34234008,94.0,Released,Some men should not be found.,The Hunted,6.0,189
0,192134,en,10.416332,2013-11-15,523511,93.0,Released,I want my money plus interest.... and a present,Dom Hemingway,5.8,212
90000000,297,en,36.069611,1998-11-12,142940100,178.0,Released,Sooner or later everyone does.,Meet Joe Black,6.9,1147
1800000,1051,en,15.978136,1971-10-09,41158757,104.0,Released,There are no rules and no holds barred when Popeye cuts loose!,The French Connection,7.4,422
20000000,172391,en,6.459787,2013-07-18,27187375,85.0,Released,"Half a zebra, a whole lot of adventure!",Khumba,5.8,72
50000000,10320,en,32.233713,2005-03-17,161451538,110.0,Released,The dead don't sleep.,The Ring Two,5.4,632
12500000,9504,en,13.939054,1992-09-15,10725228,100.0,Released,Lie. Cheat. Steal. All in a day’s work.,Glengarry Glen Ross,7.5,323
100000000,2023,en,16.759252,2004-03-05,108103450,136.0,Released,Unbridled. Unbroken. Unbeaten.,Hidalgo,6.5,318
25000000,168530,en,28.468,2014-01-07,153997819,99.0,Released,Propose to this cop's sister? Rookie mistake.,Ride Along,6.1,853
16000000,111190,en,18.790221,2013-04-03,318982,100.0,Released,,Adore,6.1,291
9000000,10803,en,12.268143,1976-06-23,25000000,119.0,Released,The only thing you can't have in Logan's world is your 30th birthday. Unless you run away.,Logan's Run,6.6,269
29000000,12771,en,8.93941,2002-08-20,16930185,100.0,Released,The One Thing That Could Bring Them Together Is Revenge.,Serving Sara,5.0,85
50000000,71552,en,39.920035,2012-04-04,234989584,113.0,Released,Save the best piece for last.,American Reunion,6.1,1611
0,32235,en,1.980265,2003-01-01,0,103.0,Released,,Northfork,6.7,24
750000,8416,it,8.429295,1970-10-21,0,107.0,Released,Bertolucci's Masterpiece about Sex and Politics,The Conformist,7.6,127
0,28353,en,1.20245,1997-08-06,13960203,93.0,Released,,Def Jam's How to Be a Player,5.3,8
0,283686,en,3.215465,2014-08-27,0,92.0,Released,,Out of the Dark,4.6,55
7000000,17908,en,5.675535,2000-01-14,0,95.0,Released,Every family needs an optimist.,My Dog Skip,6.5,69
0,310933,en,0.100533,2013-06-01,0,0.0,Released,,Bleeding Hearts,2.0,1
9000000,10179,en,3.810697,1984-03-16,0,91.0,Released,A totally SPACED adventure! ...You have to be there to see it.,The Ice Pirates,5.7,49
31500000,302156,en,27.891012,2016-04-14,14708696,113.0,Released,,Criminal,5.7,557
3000000,82507,en,41.045084,2012-03-29,77712439,110.0,Released,"Once you see him, nothing can save you.",Sinister,6.7,1573
0,218500,en,0.592821,1983-08-19,0,104.0,Released,,The Ballad of Gregorio Cortez,0.0,0
75000000,12610,en,10.54544,2001-08-07,13596911,95.0,Released,Every BODY needs a hero,Osmosis Jones,5.9,228
5000000,352978,en,1.398981,2015-08-30,0,88.0,Released,"When duty calls, plans change",Chain of Command,5.3,11
0,25786,en,4.980585,2004-11-23,0,86.0,Released,,Samantha: An American Girl Holiday,4.6,9
71000000,3050,en,21.462935,1998-06-22,294456605,85.0,Released,He doesn't just talk to the animals!,Doctor Dolittle,5.4,686
0,43743,en,0.003352,2002-01-01,0,84.0,Released,There once was a wolf named Lupold...,Fabled,0.0,0
50000000,181283,en,40.371098,2015-03-15,3324330,137.0,Released,How do you find a killer who doesn’t exist?,Child 44,6.1,547
0,34099,en,0.18094,2004-04-25,0,120.0,Released,,Brave New Girl,3.7,3
0,38570,en,5.628399,2010-06-08,0,82.0,Released,,The 41–Year–Old Virgin Who Knocked Up Sarah Marshall and Felt Superbad About It,3.2,34
22500000,256917,en,22.096286,2014-12-25,15520023,112.0,Released,To honour a promise. To find his sons. To make his peace.,The Water Diviner,6.8,431
75000000,52451,en,36.605246,2011-08-31,132274484,110.0,Released,Every legend has a new beginning.,The Three Musketeers,5.6,924
0,25983,en,8.628485,2009-04-25,0,95.0,Released,Talk on the phone. Finish your homework. Watch TV. Die.,The House of the Devil,6.0,197
20000000,9470,cn,13.658985,2004-02-10,100914445,99.0,Released,So many gangsters...so little time.,Kung Fu Hustle,7.2,831
30000000,265208,en,48.0343,2015-01-14,0,92.0,Released,Never bet against a man with a killer hand.,Wild Card,5.4,656
7000000,40794,it,7.720692,2010-02-12,8220215,110.0,Released,,Loose Cannons,7.0,118
145000000,82703,en,38.73494,2014-02-07,272912430,92.0,Released,He's Leaving His Mark On History,Mr. Peabody & Sherman,6.7,843
8000000,37735,en,45.395839,2010-09-10,74952305,92.0,Released,The rumour-filled totally false account of how I ruined my flawless reputation.,Easy A,6.7,2210
30000000,10333,en,3.845231,1991-12-25,74787599,132.0,Released,"A story about the memories that haunt us, and the truth that sets us free.",The Prince of Tides,5.9,56
0,5126,en,5.737161,2007-11-02,0,106.0,Released,"doesn't matter where you come from, as long as you find where you belong!",Martian Child,6.8,79
27000000,6968,de,7.727035,2008-09-24,0,150.0,Released,,The Baader Meinhof Complex,7.1,157
750000,9022,en,12.284939,2008-02-15,0,90.0,Released,Everyone is dying to be with her. Someone is killing for it.,All the Boys Love Mandy Lane,5.7,209
28,1613,en,9.670031,2001-12-07,14,93.0,Released,Nice Wheels. Dirty Deals. And One Mean Mother In A Kilt.,The 51st State,5.9,173
6000000,238,en,143.659698,1972-03-14,245066411,175.0,Released,An offer you can't refuse.,The Godfather,8.4,5893
15000000,25704,en,7.446069,2009-08-21,6405245,89.0,Released,A Pre-Life Crisis.,Post Grad,5.0,100
25000000,1934,en,31.792964,1998-12-11,289317794,122.0,Released,Love is the only inspiration.,Shakespeare in Love,6.8,796
7300000,2011,fr,24.281951,2007-05-23,0,95.0,Released,,Persepolis,7.7,450
25000000,9266,en,11.42943,2002-08-08,51842679,104.0,Released,"Three Friends, One Passion, No Limits.",Blue Crush,5.6,159
28000000,23172,en,14.639324,2010-01-15,45236543,94.0,Released,"Spying is easy, Babysitting is hard",The Spy Next Door,5.5,345
0,15765,en,7.921311,1993-06-09,0,118.0,Released,Who needs a heart when a heart can be broken?,What's Love Got to Do with It,6.9,72
4000000,10132,en,4.541908,1988-12-21,3468572,110.0,Released,The last neighborhood in America.,Talk Radio,6.7,46
250000000,209112,en,155.790452,2016-03-23,873260194,151.0,Released,Justice or revenge,Batman v Superman: Dawn of Justice,5.7,7004
1700000,1705,en,13.315383,1973-06-15,8844595,93.0,Released,The final chapter in the incredible Apes saga. The most suspenseful showdown ever filmed as two civilizations battle for the right to inherit what's left of the earth!,Battle for the Planet of the Apes,5.5,215
70000000,59981,en,6.682006,2013-06-13,18662027,88.0,Released,There's trouble in OZ...,Legends of Oz: Dorothy's Return,5.9,43
35000000,325133,en,50.179171,2016-05-04,108758521,91.0,Released,New neighbors.,Neighbors 2: Sorority Rising,5.6,1462
25000000,40001,en,7.946769,1996-04-19,10070000,105.0,Released,The story of a girl who is going from filthy to rich,Mrs. Winterbourne,5.3,25
10000000,9515,en,5.647538,2005-05-12,17297244,96.0,Released,A hitman and a salesman walk into a bar...,The Matador,6.2,136
0,6007,en,2.526356,2001-03-16,0,89.0,Released,,Elling,7.0,51
24000000,14369,en,4.12064,2001-11-21,14782676,89.0,Released,"They haven't quite figured it all out, but they're getting a little warmer.",Out Cold,5.8,53
25000000,13805,en,16.238961,2008-08-29,14109284,87.0,Released,Your favorite movies are going to be destroyed.,Disaster Movie,3.0,240
110000000,80274,en,45.94834,2013-10-23,125537191,114.0,Released,This is not a game.,Ender's Game,6.6,2303
35000000,88794,en,28.069419,2011-11-09,84606030,137.0,Released,The most powerful man in the world.,J. Edgar,6.0,741
0,16155,en,1.190729,1998-08-17,0,88.0,Released,Welcome to the world of disorganised crime.,Safe Men,6.3,16
4000000,10246,en,12.891276,1981-11-13,125728258,94.0,Released,Keep an eye out for the funniest movie about growing up ever made!,Porky's,6.1,183
40000000,10066,en,17.157738,2005-04-30,68766121,113.0,Released,Prey. Slay. Display,House of Wax,5.5,677
0,47686,en,0.948316,1997-01-01,0,97.0,Released,"An oddball odyssey about voyeurism, LSD and nude bowling!",Dream with the Fishes,7.7,10
11000000,14434,en,4.536745,2007-03-16,13196245,90.0,Released,In marriage no one can hear you scream.,I Think I Love My Wife,5.0,55
1000000,1781,en,14.139004,2006-01-24,46243000,100.0,Released,By far the most terrifying film you will ever see.,An Inconvenient Truth,6.7,251
3,79587,en,0.008263,2009-01-15,0,100.0,Released,Comedy,Four Single Fathers,0.0,0
73000000,8688,en,20.790703,1998-08-07,103891409,98.0,Released,Believe everything except your eyes.,Snake Eyes,5.8,327
80000000,2157,en,17.455024,1998-04-03,136159423,130.0,Released,"Danger, Will Robinson!",Lost in Space,5.0,388
11000000,10646,en,7.063053,2001-03-30,23430766,95.0,Released,The Last Man Standing Gets The Kitty.,Tomcats,4.9,74
21000000,9473,en,27.197799,1999-06-30,0,81.0,Released,UH-OH.,"South Park: Bigger, Longer & Uncut",7.1,893
68000000,853,en,41.273567,2001-03-13,96976270,131.0,Released,Some Men Are Born To Be Heroes.,Enemy at the Gates,7.2,999
